reviewId,userName,userImage,reviews,score,thumbsUpCount,reviewCreatedVersion,at,replyContent,repliedAt
6f04384f-3c96-49a5-8f69-b90801060e91,honrable walex,https://play-lh.googleusercontent.com/a-/ACB-R5TshKxCTpXPThIABMdiRRfqRZtHX7JweEsRyPIX1Q,This app is a scam they have other companies different name beware of giving out information this app it here just to get you bank information ????????and please don't send me funny message telling to contact your customer service,1,0,1.1,2021-10-27 22:57:47,"Well Walex, you probably didn't get any loan from us due to your poor credit score and indebtedness to other lending companies; reason why you are giving us a bad review. Still contact our customer support on ways you can improve your credit score and your eligibility for a loan from us.

Thank you.",2021-10-29 14:26:59
29ca762a-8870-483c-a739-42ea52c390c2,Emmanuel Akam,https://play-lh.googleusercontent.com/a/AGNmyxbmk99RrqLLuhiQfrxLvpDH6UvGbLM1xs4eZX9p=mo,I dont understand dis app How can you debit me #50 twice And yet you said you cant accept my card But you can debit my catd right? If i say you guys are scam Am not wrong How can you debit me #50 twice And still tell me you cant accept my card But you can accept my card when u wanto debit Scam!!!,1,1,1.1,2021-10-27 21:10:13,"Hi Emmanuel, 
It hurts that you'll try to defame us. You should have contacted our ever-ready-to-help support team if really you encountered a problem using the app. Anyways, we still would love to hear from you and help you resolve your issue. Please contact our customer support team at support@urgent10k.ng",2021-10-27 19:28:06
97ef144b-5d3c-41f2-a805-1a5b6b8df0bc,Laboo Laboskaraya,https://play-lh.googleusercontent.com/a-/ACB-R5SvFWdSuyFP_SLYAVjmUf-Py8pO598i7yfR9ri1,Homoscamoscamo homothiefythiefy scamorous personalities,1,0,1.1,2021-10-26 17:29:35,"Hi Laboo,
 It hurts that you'll try to defame us. We do give out loans urgently to genuine customers. Our rigorous loan processing system makes sure only eligible applicants applies and gets our loans. However, we would love to talk to you on how you can improve your credit score. Please contact our customer support team at support@urgent10k.ng",2021-10-27 19:22:28
78f03ce1-28eb-4cfa-a66c-560232dafb7b,Olaniyi Peter,https://play-lh.googleusercontent.com/a-/ACB-R5SNdCWW37meZBeamJPnGNC8cGXF_nzUkPAJxrD-,The app is false it's not functioning I just downloaded it and I apply for loan but my loan application was not approved for the first time which is very woefully my people don't waste your datato download it????????,1,28,1.1,2021-10-26 04:32:42,"Hi Olaniyi,
Your reveiw is false. We do give out loans but only to elligible persons with good credit score. It doesn't matter if you are a first timer or not, once your credit score is poor and your profile is flagged as fraudulent, you will not be eligible for a loan. Please contact our customer support  at support@urgent10k.ng for clarification",2021-10-27 19:20:29
f371c55a-ace2-4c77-9895-1f98794b692f,Abdulmalik Abdullahi,https://play-lh.googleusercontent.com/a-/ACB-R5QnQJx-Hl71MAAFdywYhSyVf7eRgb91zT5zySgz,I was no able to bind my card it keep telling me to bind the card that is link to my account wich i dont have card to that account for now any solution?,3,3,1.1,2021-10-26 03:50:20,"Hi Abdullahi, Please contact our customer support team at support@urgent10k.ng or chat on WhatsApp +2349137110506",2021-10-27 19:08:37
17acf225-4870-4000-b095-d3acdab23c3e,Akande Emmanuel,https://play-lh.googleusercontent.com/a/AGNmyxa3xqlH16m049ov3WROXEVZJxvS384iFLmndZku=mo,"Excellent application seamless, quick disbursement and very respectful staffs .",5,10,1.1,2021-10-22 15:59:14,"Hi Akande. Thank you for taking the time to leave us such a fantastic review! We are happy to hear that you enjoyed our service. Your satisfaction is our priority, and as affirmed by your review, we pride ourselves on our exceptional service.
",2021-10-22 22:20:25
dafb15d4-8b8f-4004-bb09-3bc354b5ca18,Michelle Jackson,https://play-lh.googleusercontent.com/a-/ACB-R5SVVd4gYo3qq_heYgM0s9jjca_GCZkmMcbXmYA5wQ,You don't give out loans. Stop deceiving people,1,1,1.1,2021-10-21 06:19:32,"Hi Michelle,
We do give out loans urgently to genuine customers. Our rigorous loan processing system makes sure only eligible applicants applies and gets our loans. However, we would love to talk to you on how you can improve your credit score. Please contact our customer support team at support@urgent10k.ng",2021-10-29 18:20:52
